{
  "id": "P9",
  "macro_phase": "PREPARE",
  "name": "Project Runtime & Governance Setup",
  "required_inputs": [
    "ADR"
  ],
  "required_artifacts": [
    "GOVERNANCE",
    "RUNTIME_STRUCTURE"
  ],
  "required_evidence": [],
  "required_roles": [
    "human_owner"
  ],
  "exit_gate": {
    "description": "Roles and runtime structure are set up before baselining. Project memory (GP-9) is a build-level capability owned by nogap_memory.py, not a per-project configuration this phase gates - see methodology/enforcement.json.",
    "checks": [
      "governance_defines_acceptance_authority",
      "runtime_structure_initialized"
    ]
  },
  "allowed_next": [
    "P10"
  ],
  "allowed_back_transitions": [
    "P8"
  ],
  "failure_transition": null,
  "minimum_profile": "LIGHT"
}
